{
  "$schema": "https://json-schema.org/draft/2020-12/schema",
  "$id": "urn:designflow:schema:v1:authoring-context-snapshot",
  "title": "AuthoringContextSnapshot v1",
  "type": "object",
  "additionalProperties": false,
  "required": ["schemaVersion", "snapshotId", "snapshotDigest", "designSystem", "sourceRefs", "capturedAt"],
  "properties": {
    "schemaVersion": { "const": "1.0" },
    "snapshotId": { "$ref": "urn:designflow:schema:v1:common#/$defs/identifier" },
    "snapshotDigest": { "$ref": "urn:designflow:schema:v1:common#/$defs/sha256" },
    "designSystem": {
      "type": "object",
      "additionalProperties": false,
      "required": ["ref", "tokenDocuments", "components", "patterns"],
      "properties": {
        "ref": {
          "anyOf": [
            { "$ref": "urn:designflow:schema:v1:common#/$defs/externalRef" },
            { "type": "null" }
          ]
        },
        "tokenDocuments": { "$ref": "#/$defs/entries" },
        "components": { "$ref": "#/$defs/entries" },
        "patterns": { "$ref": "#/$defs/entries" }
      }
    },
    "sourceRefs": {
      "type": "array",
      "uniqueItems": true,
      "items": {
        "type": "object",
        "additionalProperties": false,
        "required": ["ref", "digest"],
        "properties": {
          "ref": { "$ref": "urn:designflow:schema:v1:common#/$defs/externalRef" },
          "digest": { "$ref": "urn:designflow:schema:v1:common#/$defs/sha256" }
        }
      }
    },
    "capturedAt": { "type": "string", "format": "date-time" }
  },
  "$defs": {
    "entries": {
      "type": "array",
      "items": {
        "type": "object",
        "additionalProperties": false,
        "required": ["id", "digest", "value"],
        "properties": {
          "id": { "$ref": "urn:designflow:schema:v1:common#/$defs/nonEmptyString" },
          "digest": { "$ref": "urn:designflow:schema:v1:common#/$defs/sha256" },
          "value": true
        }
      }
    }
  }
}
